{
   "$id": "https://openpackages.io/schema/repo",
   "$schema": "http://json-schema.org/draft-07/schema#",
   "additionalProperties": false,
   "properties": {
      "labels": {
         "patternProperties": {
            ".{1,}": {
               "type": "string"
            }
         },
         "type": "object"
      },
      "name": {
         "type": "string"
      },
      "namespace": {
         "type": "string"
      },
      "package": {
         "additionalProperties": false,
         "properties": {
            "documentation": {
               "type": "string"
            },
            "icon": {
               "type": "string"
            },
            "type": {
               "type": "string"
            }
         },
         "type": "object"
      },
      "project": {
         "type": "string"
      },
      "size": {
         "maximum": 18446744073709551616,
         "minimum": 0,
         "type": "integer"
      }
   },
   "type": "object"
}
