{
   "labels": {
      "costCenter": "cs-foo",
      "maintainer": "Billy Seiken",
      "team": "team-example"
   },
   "name": "repository-example-foo",
   "namespace": "namespace-example-foo",
   "package": {
      "documentation": "https://github.com/opencontainers/image-spec",
      "icon": "https://opencontainers/static/icon-small.png",
      "type": "OCI Image"
   },
   "project": "project-example-foo",
   "size": 34252334
}
